{
  "$schema": "http://json-schema.org/schema#",
  "additionalProperties": false,
  "properties": {
    "clients": {
      "items": {
        "type": "string"
      },
      "maxItems": 10,
      "minItems": 0,
      "type": "array"
    },
    "companiesHouseNumber": {
      "maxLength": 8,
      "minLength": 8,
      "type": "string"
    },
    "contactInformation": {
      "items": {
        "$ref": "file:json_schemas/contact-information.json"
      },
      "minItems": 1,
      "type": "array"
    },
    "description": {
      "type": "string"
    },
    "dunsNumber": {
      "pattern": "^[0-9]+$",
      "type": "string"
    },
    "eSourcingId": {
      "pattern": "^[0-9]+$",
      "type": "string"
    },
    "name": {
      "type": "string"
    }
  },
  "required": [
    "contactInformation",
    "dunsNumber",
    "name"
  ],
  "title": "Schema to validate new supplier sign-up",
  "type": "object"
}
